{
  "schema_version": "1.0",
  "id": "ctx-synth-001",
  "type": "user_context",
  "created_at": "2025-01-01T00:00:00Z",
  "updated_at": "2025-01-01T00:00:00Z",
  "provenance": {
    "source": "synthetic_generator",
    "source_id": "gen-001",
    "agent_version": "1.0.0",
    "metadata": {}
  },
  "data": {
    "preferences": {
      "editor": "vim",
      "test_framework": "pytest"
    },
    "constraints": {
      "max_parallel_jobs": 4,
      "require_verification_steps": true
    },
    "working_hours": {
      "tz": "UTC",
      "start": "09:00",
      "end": "17:00"
    },
    "communication_style": {
      "verbosity": "concise"
    },
    "environment": {
      "os": "Linux"
    }
  }
}
