{
  "schema_version": "1.0",
  "id": "mem-synth-001",
  "type": "memory",
  "created_at": "2025-01-01T00:00:00Z",
  "updated_at": "2025-01-01T00:00:00Z",
  "provenance": {
    "source": "synthetic_generator",
    "source_id": "gen-001",
    "agent_version": "1.0.0",
    "metadata": {}
  },
  "data": {
    "subject": "Pytest configuration preference",
    "content": "User prefers concise test output with tracebacks on failure.",
    "memory_type": "episodic",
    "importance": 0.8,
    "tags": ["testing", "pytest", "preferences"],
    "associations": ["ctx-synth-001"]
  }
}
