{
  "schema_version": "1.0",
  "id": "know-synth-001",
  "type": "knowledge",
  "created_at": "2025-01-01T00:00:00Z",
  "updated_at": "2025-01-01T00:00:00Z",
  "provenance": {
    "source": "synthetic_generator",
    "source_id": "gen-001",
    "agent_version": "1.0.0",
    "metadata": {}
  },
  "data": {
    "domain": "software_engineering",
    "topic": "atomic_file_operations",
    "statement": "Writing to a temporary file and renaming it atomically prevents partial file corruption during crashes.",
    "confidence": 0.98,
    "sources": ["POSIX filesystem standards documentation"],
    "tags": ["posix", "atomic", "file_io"]
  }
}
