{
  "schema_version": "1.0",
  "id": "evt-synth-101",
  "type": "event",
  "created_at": "2025-01-01T00:00:00Z",
  "updated_at": "2025-01-01T00:00:00Z",
  "provenance": {
    "source": "synthetic_generator",
    "source_id": "gen-001",
    "agent_version": "1.0.0",
    "metadata": {}
  },
  "data": {
    "event_type": "STRATEGY_APPLIED",
    "summary": "Strategy strat-synth-101 applied to task task-synth-101",
    "details": {
      "strategy_id": "strat-synth-101",
      "task_id": "task-synth-101",
      "outcome": "SUCCESS"
    },
    "actor": "agent-core"
  }
}
